{"book":"Hag","candidate_only":true,"controller_event_ids":["evt-hag-r8-held-1-literary_form_scout-assigned","evt-hag-r8-held-1-literary_form_scout-finished","evt-hag-r8-held-1-literary_form_scout-received"],"identity":{"agent_instance_id":"codex-hag-role-02","assignment_id":"asg-hag-r8-held-1-literary_form_scout","execution_id":"exec-hag-r8-held-1-literary_form_scout","provider_family":"codex-gpt5-correlated-local","role_id":"literary_form_scout"},"input_manifest_sha256":"sha256:e0b8a37a1e76fb27bff70b177849e5b41213a156e6f86f11d74b1db06620a4aa","kind":"role_report","non_authorizing":true,"observations":[{"claim":"The current Hag candidate file contains 2 low-confidence structural units with literary-form metadata.","confidence":"low","evidence_refs":["whole_bible_role_source_matrix.v1","book_chunks/Hag/chunks.jsonl"],"observation_id":"Hag-R8-2-1","scope":"Hag"},{"claim":"Chapter seams are provisional; speeches, songs, registers, legal units, and narrative continuities require red-team review.","confidence":"low","evidence_refs":["whole_bible_role_source_matrix.v1","book_chunks/Hag/chunks.jsonl"],"observation_id":"Hag-R8-2-2","scope":"Hag"}],"run_id":"hag-r8-held-1","schema_version":"whole_bible_b01_role_report.v2","source_refs":[".ai/scratch/multi_model_bible_chunking/M7_sol/book_chunks/Hag/chunks.jsonl","docs/governance/WHOLE_BIBLE_B01_TYPED_CONTRACT.md"],"stage_attempt_id":"b01-controller-1","uncertainties":["shared Codex substrate; not an independent provider vote","B01 receipt-only; no boundary promotion"]}