{"book":"2Sam","candidate_only":true,"controller_event_ids":["evt-2sam-r8-held-1-second_temple_rabbinic_context_scout-assigned","evt-2sam-r8-held-1-second_temple_rabbinic_context_scout-finished","evt-2sam-r8-held-1-second_temple_rabbinic_context_scout-received"],"identity":{"agent_instance_id":"codex-2sam-role-04","assignment_id":"asg-2sam-r8-held-1-second_temple_rabbinic_context_scout","execution_id":"exec-2sam-r8-held-1-second_temple_rabbinic_context_scout","provider_family":"codex-gpt5-correlated-local","role_id":"second_temple_rabbinic_context_scout"},"input_manifest_sha256":"sha256:47ab0bf204fa9a109d25133c720945f59750d2ce809744d45433956f4c2470d4","kind":"role_report","non_authorizing":true,"observations":[{"claim":"No qualified ancient Jewish, Second Temple, or rabbinic corpus is activated for this packet.","confidence":"low","evidence_refs":["whole_bible_role_source_matrix.v1","book_chunks/2Sam/chunks.jsonl"],"observation_id":"2Sam-R8-4-1","scope":"2Sam"},{"claim":"Ancient-context lane is an explicit gap receipt; no simulated expertise is asserted.","confidence":"low","evidence_refs":["whole_bible_role_source_matrix.v1","book_chunks/2Sam/chunks.jsonl"],"observation_id":"2Sam-R8-4-2","scope":"2Sam"}],"run_id":"2sam-r8-held-1","schema_version":"whole_bible_b01_role_report.v2","source_refs":[".ai/scratch/multi_model_bible_chunking/M7_sol/book_chunks/2Sam/chunks.jsonl","docs/governance/WHOLE_BIBLE_B01_TYPED_CONTRACT.md"],"stage_attempt_id":"b01-controller-1","uncertainties":["shared Codex substrate; not an independent provider vote","B01 receipt-only; no boundary promotion"]}