{"book":"Luke","candidate_only":true,"controller_event_ids":["evt-luke-r8-held-1-canonical_relations_and_premortem_scout-assigned","evt-luke-r8-held-1-canonical_relations_and_premortem_scout-finished","evt-luke-r8-held-1-canonical_relations_and_premortem_scout-received"],"identity":{"agent_instance_id":"codex-luke-role-03","assignment_id":"asg-luke-r8-held-1-canonical_relations_and_premortem_scout","execution_id":"exec-luke-r8-held-1-canonical_relations_and_premortem_scout","provider_family":"codex-gpt5-correlated-local","role_id":"canonical_relations_and_premortem_scout"},"input_manifest_sha256":"sha256:20c83f64c3ea17003085e098962372e3a3f344f70c25da6305172f9bc9604ef4","kind":"role_report","non_authorizing":true,"observations":[{"claim":"Canonical relation seeds for Luke remain unverified context candidates and cannot authorize graph edges or local splits.","confidence":"low","evidence_refs":["whole_bible_role_source_matrix.v1","book_chunks/Luke/chunks.jsonl"],"observation_id":"Luke-NT-3","scope":"Luke"}],"run_id":"luke-r8-held-1","schema_version":"whole_bible_b01_role_report.v2","source_refs":[".ai/scratch/multi_model_bible_chunking/M7_sol/book_chunks/Luke/chunks.jsonl","data/raw/original_language/greek/cntr_sr/source_manifest.yaml"],"stage_attempt_id":"b01-controller-1","uncertainties":["Greek sources are corpus-level and not independent provider votes","B01 receipt-only"]}