{"book":"Neh","candidate_only":true,"controller_event_ids":["evt-neh-r8-held-1-original_language_translation_scout-assigned","evt-neh-r8-held-1-original_language_translation_scout-finished","evt-neh-r8-held-1-original_language_translation_scout-received"],"identity":{"agent_instance_id":"codex-neh-role-01","assignment_id":"asg-neh-r8-held-1-original_language_translation_scout","execution_id":"exec-neh-r8-held-1-original_language_translation_scout","provider_family":"codex-gpt5-correlated-local","role_id":"original_language_translation_scout"},"input_manifest_sha256":"sha256:7b5088330b5098eb9c27e03f0ff4f8d068b1555ee431ab1e9004391b4b2c4127","kind":"role_report","non_authorizing":true,"observations":[{"claim":"The OT source lane records Hebrew/Aramaic translation pressure for Neh; roots and one gloss cannot authorize a boundary.","confidence":"low","evidence_refs":["whole_bible_role_source_matrix.v1","book_chunks/Neh/chunks.jsonl"],"observation_id":"Neh-R8-1-1","scope":"Neh"},{"claim":"OSHB and UXLC are correlated Leningrad-family evidence; any versification or lexical uncertainty remains held.","confidence":"low","evidence_refs":["whole_bible_role_source_matrix.v1","book_chunks/Neh/chunks.jsonl"],"observation_id":"Neh-R8-1-2","scope":"Neh"}],"run_id":"neh-r8-held-1","schema_version":"whole_bible_b01_role_report.v2","source_refs":[".ai/scratch/multi_model_bible_chunking/M7_sol/book_chunks/Neh/chunks.jsonl","docs/governance/WHOLE_BIBLE_B01_TYPED_CONTRACT.md"],"stage_attempt_id":"b01-controller-1","uncertainties":["shared Codex substrate; not an independent provider vote","B01 receipt-only; no boundary promotion"]}