{"book":"1Kgs","candidate_only":true,"controller_event_ids":["evt-1kgs-r8-held-1-literary_form_scout-assigned","evt-1kgs-r8-held-1-literary_form_scout-finished","evt-1kgs-r8-held-1-literary_form_scout-received"],"identity":{"agent_instance_id":"codex-1kgs-role-02","assignment_id":"asg-1kgs-r8-held-1-literary_form_scout","execution_id":"exec-1kgs-r8-held-1-literary_form_scout","provider_family":"codex-gpt5-correlated-local","role_id":"literary_form_scout"},"input_manifest_sha256":"sha256:e07064bae1f49aeaf345a1f42ba90a74e96f6656edd087403b9daba4cf255a21","kind":"role_report","non_authorizing":true,"observations":[{"claim":"The current 1Kgs candidate file contains 15 low-confidence structural units with literary-form metadata.","confidence":"low","evidence_refs":["whole_bible_role_source_matrix.v1","book_chunks/1Kgs/chunks.jsonl"],"observation_id":"1Kgs-R8-2-1","scope":"1Kgs"},{"claim":"Chapter seams are provisional; speeches, songs, registers, legal units, and narrative continuities require red-team review.","confidence":"low","evidence_refs":["whole_bible_role_source_matrix.v1","book_chunks/1Kgs/chunks.jsonl"],"observation_id":"1Kgs-R8-2-2","scope":"1Kgs"}],"run_id":"1kgs-r8-held-1","schema_version":"whole_bible_b01_role_report.v2","source_refs":[".ai/scratch/multi_model_bible_chunking/M7_sol/book_chunks/1Kgs/chunks.jsonl","docs/governance/WHOLE_BIBLE_B01_TYPED_CONTRACT.md"],"stage_attempt_id":"b01-controller-1","uncertainties":["shared Codex substrate; not an independent provider vote","B01 receipt-only; no boundary promotion"]}