{"book":"Gal","candidate_only":true,"controller_event_ids":["evt-gal-r8-held-1-original_language_translation_scout-assigned","evt-gal-r8-held-1-original_language_translation_scout-finished","evt-gal-r8-held-1-original_language_translation_scout-received"],"identity":{"agent_instance_id":"codex-gal-role-01","assignment_id":"asg-gal-r8-held-1-original_language_translation_scout","execution_id":"exec-gal-r8-held-1-original_language_translation_scout","provider_family":"codex-gpt5-correlated-local","role_id":"original_language_translation_scout"},"input_manifest_sha256":"sha256:c08a45abd682654b4952cf1305ddea147628ae7329c89627d02085577a16ccdf","kind":"role_report","non_authorizing":true,"observations":[{"claim":"Koine Greek translation and lexical pressures for Gal require qualified corpus comparison; no single gloss authorizes a boundary.","confidence":"low","evidence_refs":["whole_bible_role_source_matrix.v1","book_chunks/Gal/chunks.jsonl"],"observation_id":"Gal-NT-1","scope":"Gal"}],"run_id":"gal-r8-held-1","schema_version":"whole_bible_b01_role_report.v2","source_refs":[".ai/scratch/multi_model_bible_chunking/M7_sol/book_chunks/Gal/chunks.jsonl","data/raw/original_language/greek/cntr_sr/source_manifest.yaml"],"stage_attempt_id":"b01-controller-1","uncertainties":["Greek sources are corpus-level and not independent provider votes","B01 receipt-only"]}