{"book":"Ezra","candidate_only":true,"controller_event_ids":["evt-ezra-r8-held-1-literary_form_scout-assigned","evt-ezra-r8-held-1-literary_form_scout-finished","evt-ezra-r8-held-1-literary_form_scout-received"],"identity":{"agent_instance_id":"codex-ezra-role-02","assignment_id":"asg-ezra-r8-held-1-literary_form_scout","execution_id":"exec-ezra-r8-held-1-literary_form_scout","provider_family":"codex-gpt5-correlated-local","role_id":"literary_form_scout"},"input_manifest_sha256":"sha256:4734939dfe5abea409398abcfd9085c7cfd945c0d5bbe6f70bdfa0b1b2112704","kind":"role_report","non_authorizing":true,"observations":[{"claim":"The current Ezra candidate file contains 9 low-confidence structural units with literary-form metadata.","confidence":"low","evidence_refs":["whole_bible_role_source_matrix.v1","book_chunks/Ezra/chunks.jsonl"],"observation_id":"Ezra-R8-2-1","scope":"Ezra"},{"claim":"Chapter seams are provisional; speeches, songs, registers, legal units, and narrative continuities require red-team review.","confidence":"low","evidence_refs":["whole_bible_role_source_matrix.v1","book_chunks/Ezra/chunks.jsonl"],"observation_id":"Ezra-R8-2-2","scope":"Ezra"}],"run_id":"ezra-r8-held-1","schema_version":"whole_bible_b01_role_report.v2","source_refs":[".ai/scratch/multi_model_bible_chunking/M7_sol/book_chunks/Ezra/chunks.jsonl","docs/governance/WHOLE_BIBLE_B01_TYPED_CONTRACT.md"],"stage_attempt_id":"b01-controller-1","uncertainties":["shared Codex substrate; not an independent provider vote","B01 receipt-only; no boundary promotion"]}