{"book":"Joel","candidate_only":true,"controller_event_ids":["evt-joel-r8-held-1-canonical_relations_and_premortem_scout-assigned","evt-joel-r8-held-1-canonical_relations_and_premortem_scout-finished","evt-joel-r8-held-1-canonical_relations_and_premortem_scout-received"],"identity":{"agent_instance_id":"codex-joel-role-03","assignment_id":"asg-joel-r8-held-1-canonical_relations_and_premortem_scout","execution_id":"exec-joel-r8-held-1-canonical_relations_and_premortem_scout","provider_family":"codex-gpt5-correlated-local","role_id":"canonical_relations_and_premortem_scout"},"input_manifest_sha256":"sha256:4185c52e9b304ec4a0966ee611ba9dd41832f173eb6e5ead687ab7bbf0e6a8aa","kind":"role_report","non_authorizing":true,"observations":[{"claim":"Internal/canonical relation seeds for Joel are context candidates only and do not authorize graph edges or local splits.","confidence":"low","evidence_refs":["whole_bible_role_source_matrix.v1","book_chunks/Joel/chunks.jsonl"],"observation_id":"Joel-R8-3-1","scope":"Joel"},{"claim":"Premortem holds include chapter-only fragmentation, cross-reference overreach, and theology-smuggling.","confidence":"low","evidence_refs":["whole_bible_role_source_matrix.v1","book_chunks/Joel/chunks.jsonl"],"observation_id":"Joel-R8-3-2","scope":"Joel"}],"run_id":"joel-r8-held-1","schema_version":"whole_bible_b01_role_report.v2","source_refs":[".ai/scratch/multi_model_bible_chunking/M7_sol/book_chunks/Joel/chunks.jsonl","docs/governance/WHOLE_BIBLE_B01_TYPED_CONTRACT.md"],"stage_attempt_id":"b01-controller-1","uncertainties":["shared Codex substrate; not an independent provider vote","B01 receipt-only; no boundary promotion"]}