{"book":"Josh","candidate_only":true,"controller_event_ids":["evt-josh-r8-held-1-original_language_translation_scout-assigned","evt-josh-r8-held-1-original_language_translation_scout-finished","evt-josh-r8-held-1-original_language_translation_scout-received"],"identity":{"agent_instance_id":"codex-josh-role-01","assignment_id":"asg-josh-r8-held-1-original_language_translation_scout","execution_id":"exec-josh-r8-held-1-original_language_translation_scout","provider_family":"codex-gpt5-correlated-local","role_id":"original_language_translation_scout"},"input_manifest_sha256":"sha256:a5bf99a9f54dcefb3a4a48a7986dbb542c56efda3cf9cfdb2c1ab605b25c2c3b","kind":"role_report","non_authorizing":true,"observations":[{"claim":"The OT source lane records Hebrew/Aramaic translation pressure for Josh; roots and one gloss cannot authorize a boundary.","confidence":"low","evidence_refs":["whole_bible_role_source_matrix.v1","book_chunks/Josh/chunks.jsonl"],"observation_id":"Josh-R8-1-1","scope":"Josh"},{"claim":"OSHB and UXLC are correlated Leningrad-family evidence; any versification or lexical uncertainty remains held.","confidence":"low","evidence_refs":["whole_bible_role_source_matrix.v1","book_chunks/Josh/chunks.jsonl"],"observation_id":"Josh-R8-1-2","scope":"Josh"}],"run_id":"josh-r8-held-1","schema_version":"whole_bible_b01_role_report.v2","source_refs":[".ai/scratch/multi_model_bible_chunking/M7_sol/book_chunks/Josh/chunks.jsonl","docs/governance/WHOLE_BIBLE_B01_TYPED_CONTRACT.md"],"stage_attempt_id":"b01-controller-1","uncertainties":["shared Codex substrate; not an independent provider vote","B01 receipt-only; no boundary promotion"]}