{"book":"Phlm","candidate_only":true,"controller_event_ids":["evt-phlm-r8-held-1-original_language_translation_scout-assigned","evt-phlm-r8-held-1-original_language_translation_scout-finished","evt-phlm-r8-held-1-original_language_translation_scout-received"],"identity":{"agent_instance_id":"codex-phlm-role-01","assignment_id":"asg-phlm-r8-held-1-original_language_translation_scout","execution_id":"exec-phlm-r8-held-1-original_language_translation_scout","provider_family":"codex-gpt5-correlated-local","role_id":"original_language_translation_scout"},"input_manifest_sha256":"sha256:8ea48374ce8d1431dd9d3237a03cd8e2a133f6cb212d9914fb03177c78d60fc3","kind":"role_report","non_authorizing":true,"observations":[{"claim":"Koine Greek translation and lexical pressures for Phlm require qualified corpus comparison; no single gloss authorizes a boundary.","confidence":"low","evidence_refs":["whole_bible_role_source_matrix.v1","book_chunks/Phlm/chunks.jsonl"],"observation_id":"Phlm-NT-1","scope":"Phlm"}],"run_id":"phlm-r8-held-1","schema_version":"whole_bible_b01_role_report.v2","source_refs":[".ai/scratch/multi_model_bible_chunking/M7_sol/book_chunks/Phlm/chunks.jsonl","data/raw/original_language/greek/cntr_sr/source_manifest.yaml"],"stage_attempt_id":"b01-controller-1","uncertainties":["Greek sources are corpus-level and not independent provider votes","B01 receipt-only"]}