{"book":"Acts","candidate_only":true,"controller_event_ids":["evt-acts-r8-held-1-literary_form_scout-assigned","evt-acts-r8-held-1-literary_form_scout-finished","evt-acts-r8-held-1-literary_form_scout-received"],"identity":{"agent_instance_id":"codex-acts-role-02","assignment_id":"asg-acts-r8-held-1-literary_form_scout","execution_id":"exec-acts-r8-held-1-literary_form_scout","provider_family":"codex-gpt5-correlated-local","role_id":"literary_form_scout"},"input_manifest_sha256":"sha256:3bd0cedfe283d913b73d615b208b022bf7e6c6a252ba3b17a9f7307fc8f2a3ba","kind":"role_report","non_authorizing":true,"observations":[{"claim":"The Acts candidate file contains 13 low-confidence discourse/form units requiring literary red-team review.","confidence":"low","evidence_refs":["whole_bible_role_source_matrix.v1","book_chunks/Acts/chunks.jsonl"],"observation_id":"Acts-NT-2","scope":"Acts"}],"run_id":"acts-r8-held-1","schema_version":"whole_bible_b01_role_report.v2","source_refs":[".ai/scratch/multi_model_bible_chunking/M7_sol/book_chunks/Acts/chunks.jsonl","data/raw/original_language/greek/cntr_sr/source_manifest.yaml"],"stage_attempt_id":"b01-controller-1","uncertainties":["Greek sources are corpus-level and not independent provider votes","B01 receipt-only"]}